title;description;github_link;demo_link;icon;keywords;tech_stack_1;tech_stack_2;tech_stack_3;tech_stack_4;image
Personal web page;I developed this web page in order to improve my knowledge in web-app development using Django, html and CSS;https://github.com/pasturl/Portfolio-website-django;https://lucas-pastur-romay.herokuapp.com/;ai_brain.png;"Django; Webpage; HTML; CSS";https://cdn.jsdelivr.net/gh/devicons/devicon/icons/python/python-original-wordmark.svg;https://cdn.jsdelivr.net/gh/devicons/devicon/icons/css3/css3-plain-wordmark.svg;https://cdn.jsdelivr.net/gh/devicons/devicon/icons/django/django-plain-wordmark.svg;https://cdn.jsdelivr.net/gh/devicons/devicon/icons/github/github-original-wordmark.svg;web_page.png
PhD Thesis and research papers;PhD and scientific papers in Artificial Intelligence and Neuroscience;;https://scholar.google.es/citations?user=ZMOI-J0AAAAJ&hl=es;scholar.png;"Artificial Intelligence; Neuroscience;";https://cdn.jsdelivr.net/gh/devicons/devicon/icons/python/python-original-wordmark.svg;https://cdn.jsdelivr.net/gh/devicons/devicon/icons/tensorflow/tensorflow-original-wordmark.svg;https://cdn.jsdelivr.net/gh/devicons/devicon/icons/c/c-plain.svg;https://cdn.jsdelivr.net/gh/devicons/devicon/icons/bash/bash-original.svg;ai.png
Sign language translator;Application to real-time translation sign language to text;https://github.com/pasturl/sign-language;;;"Computer Vision; Video classification;";https://cdn.jsdelivr.net/gh/devicons/devicon/icons/python/python-original-wordmark.svg;https://cdn.jsdelivr.net/gh/devicons/devicon/icons/tensorflow/tensorflow-original-wordmark.svg;https://cdn.jsdelivr.net/gh/devicons/devicon/icons/postgresql/postgresql-original.svg;https://cdn.jsdelivr.net/gh/devicons/devicon/icons/github/github-original-wordmark.svg;sign.jpg
Hack4NF 2022;Participate in a hackathon about a rare disease called Neurofibromatosis cancer using ML with genomic and clinical data;https://github.com/pasturl/Hack4NF-2022;;;"Cancer; Healthcare; Genomics;";https://cdn.jsdelivr.net/gh/devicons/devicon/icons/python/python-original-wordmark.svg;https://cdn-icons-png.flaticon.com/64/1742/1742006.png;https://cdn.jsdelivr.net/gh/devicons/devicon/icons/django/django-plain-wordmark.svg;https://cdn.jsdelivr.net/gh/devicons/devicon/icons/github/github-original-wordmark.svg;hack4NF.png
Sentiment analysis;Sentiment analysis using Machine Learning models (BERT, LightGBM, Logistic Regression);https://github.com/pasturl/Sentiment-Analysis;;;"Natural Language Processing; Artificial Neural Networks; Transformers;";https://cdn.jsdelivr.net/gh/devicons/devicon/icons/python/python-original-wordmark.svg;https://cdn.jsdelivr.net/gh/devicons/devicon/icons/tensorflow/tensorflow-original-wordmark.svg;https://cdn.jsdelivr.net/gh/devicons/devicon/icons/postgresql/postgresql-original.svg;https://cdn.jsdelivr.net/gh/devicons/devicon/icons/github/github-original-wordmark.svg;wordcloud_sentiment.png
Dashboard Covid data;Process covid data and prepare a dashboard using plotly and streamlit.;https://github.com/pasturl/covid-map;https://pasturl-covid-map-dashboard-streamlitapp-e206f3.streamlitapp.com/;streamlit.png;"Time series; Visualization; Maps; Geospacial data";https://cdn.jsdelivr.net/gh/devicons/devicon/icons/python/python-original-wordmark.svg;https://res.cloudinary.com/crunchbase-production/image/upload/c_lpad,h_170,w_170,f_auto,b_white,q_auto:eco,dpr_1/z3ahdkytzwi1jxlpazje;https://upload.wikimedia.org/wikipedia/commons/8/8a/Plotly_logo_for_digital_final_%286%29.png;https://cdn-icons-png.flaticon.com/512/149/149442.png;covid_app.jpg